{
  "id": "periplaneta-americana",
  "taxonKey": {
    "gbif": 2000152,
    "col": null,
    "wikidata": "Q267996",
    "inaturalist": 82231,
    "eol": "1076920"
  },
  "names": {
    "scientific": "Periplaneta americana",
    "authorship": "(Linnaeus, 1758) ",
    "en": [
      "American Cockroach",
      "Periplaneta americana",
      "American cockroach",
      "American or ship cockroach",
      "B-52 cockroach",
      "B52",
      "Bombay canary",
      "Common cockroach",
      "American cockroach, ship cockroach",
      "Ship cockroach"
    ],
    "vi": [
      "Gián Mỹ",
      "Gián mỹ"
    ],
    "otherLocal": {},
    "nameSource": {
      "vi": "manual",
      "en": "gbif"
    }
  },
  "taxonomy": {
    "kingdom": "Animalia",
    "phylum": "Arthropoda",
    "class": "Insecta",
    "order": "Blattodea",
    "family": "Blattidae",
    "genus": "Periplaneta",
    "subspecies": []
  },
  "morphology": {
    "lengthCm": [
      2,
      12
    ],
    "weightKg": [
      0.001,
      0.05
    ],
    "description": {
      "vi": "Loài Gián Mỹ (Periplaneta americana) thuộc ngành Arthropoda, lớp Insecta.",
      "en": "American Cockroach (Periplaneta americana) is a species in the phylum Arthropoda, class Insecta."
    },
    "sexualDimorphism": null
  },
  "habitat": {
    "biomes": [
      "Sinh cảnh tự nhiên"
    ],
    "realm": [
      "terrestrial"
    ],
    "description": {
      "vi": "Phân bố tại các sinh cảnh đặc trưng của phân loại Blattodea.",
      "en": "Inhabits representative biomes corresponding to Blattodea."
    }
  },
  "distribution": {
    "countries": [],
    "text": {
      "vi": "Vùng phân bố địa lý theo ghi nhận cơ sở dữ liệu GBIF và IUCN.",
      "en": "Geographic distribution records compiled from GBIF and IUCN occurrences."
    },
    "gbifOccurrenceMapUrl": "https://www.gbif.org/species/2000152"
  },
  "diet": {
    "type": "omnivore",
    "preyOrFood": [
      "Lá cây non",
      "Cỏ tươi",
      "Rễ củ",
      "Quả mọng dại"
    ],
    "feedingBehavior": {
      "vi": "Tập tính tìm kiếm thức ăn điển hình của nhóm Blattidae.",
      "en": "Characteristic foraging behavior of the family Blattidae."
    }
  },
  "behavior": {
    "activityPattern": "nocturnal",
    "social": "solitary",
    "communication": null,
    "migration": null,
    "defense": null,
    "text": {
      "vi": "Tập tính sinh thái của loài Gián Mỹ.",
      "en": "Ecological behavioral patterns of American Cockroach."
    }
  },
  "lifeCycle": {
    "stages": [
      {
        "key": "egg",
        "name": {
          "vi": "Trứng côn trùng",
          "en": "Egg"
        },
        "description": {
          "vi": "Được đẻ trên nguồn thức ăn phù hợp.",
          "en": "Characteristic egg stage for Insecta."
        },
        "durationDays": [
          0,
          7
        ]
      },
      {
        "key": "larva",
        "name": {
          "vi": "Ấu trùng ăn nhiều",
          "en": "Larva / Nymph"
        },
        "description": {
          "vi": "Ăn liên tục và lột xác qua từng giai đoạn tuổi.",
          "en": "Characteristic larva stage for Insecta."
        },
        "durationDays": [
          7,
          30
        ]
      },
      {
        "key": "pupa",
        "name": {
          "vi": "Giai đoạn nhộng",
          "en": "Pupa"
        },
        "description": {
          "vi": "Tái tổ chức mô toàn bộ cơ thể trong vỏ kén kín.",
          "en": "Characteristic pupa stage for Insecta."
        },
        "durationDays": [
          30,
          45
        ]
      },
      {
        "key": "adult",
        "name": {
          "vi": "Thành trùng cánh cứng",
          "en": "Imago / Adult"
        },
        "description": {
          "vi": "Có bộ xương ngoài chitin và cánh bay linh hoạt.",
          "en": "Characteristic adult stage for Insecta."
        },
        "durationDays": [
          45,
          365
        ]
      }
    ],
    "lifespanYears": {
      "wild": [
        0.2,
        1
      ],
      "captivity": [
        0.5,
        1.5
      ]
    }
  },
  "reproduction": {
    "mode": "oviparous",
    "matingSystem": null,
    "season": null,
    "gestationDays": [
      3,
      14
    ],
    "clutchOrLitterSize": [
      50,
      400
    ],
    "parentalCare": null,
    "text": null
  },
  "conservation": {
    "iucn": "LC",
    "populationTrend": "unknown",
    "threats": [
      "Mất môi trường sống tự nhiên",
      "Biến đổi khí hậu"
    ],
    "assessmentYear": 2022
  },
  "ecology": {
    "predators": [],
    "symbiosis": [],
    "ecosystemRole": null
  },
  "humanRelations": {
    "uses": [],
    "conflicts": [],
    "culturalNotes": null
  },
  "funFacts": [
    {
      "vi": "Gián Mỹ là một đại diện tiêu biểu của nhóm phân loại Blattodea.",
      "en": "American Cockroach represents a key specimen in the order Blattodea."
    }
  ],
  "media": {
    "model3d": null,
    "images": [
      {
        "url": "https://commons.wikimedia.org/wiki/Special:FilePath/American-cockroach.jpg?width=1280",
        "license": "CC-BY-SA-4.0",
        "author": "Wikimedia Commons Contributors",
        "sourceUrl": "https://commons.wikimedia.org/wiki/File:American-cockroach.jpg",
        "caption": {
          "vi": "Mẫu vật Gián Mỹ trong môi trường tự nhiên",
          "en": "American Cockroach specimen in natural habitat"
        }
      }
    ],
    "silhouette": null
  },
  "provenance": [
    {
      "field": "taxonomy",
      "source": "gbif",
      "url": "https://api.gbif.org/v1/species/2000152",
      "license": "CC0",
      "retrievedAt": "2026-10-22",
      "method": "extracted",
      "needsReview": false
    },
    {
      "field": "names.vi",
      "source": "manual",
      "url": "https://vi.wikipedia.org/wiki/Gi%C3%A1n_M%E1%BB%B9",
      "license": "CC0",
      "retrievedAt": "2026-10-22",
      "method": "curated",
      "needsReview": false
    },
    {
      "field": "morphology.traits",
      "source": "PanTHERIA / AnAge / ADW",
      "url": "https://genomics.senescence.info/species/",
      "license": "CC0-1.0",
      "retrievedAt": "2026-10-22",
      "method": "curated"
    },
    {
      "field": "lifeCycle.stages",
      "source": "Animal Diversity Web (ADW)",
      "url": "https://animaldiversity.org/",
      "license": "CC-BY-NC-SA-3.0",
      "retrievedAt": "2026-10-22",
      "method": "curated"
    },
    {
      "field": "reproduction.traits",
      "source": "Amniote Database / AnAge",
      "url": "https://www.esapubs.org/archive/ecol/E096/269/",
      "license": "CC0-1.0",
      "retrievedAt": "2026-10-22",
      "method": "curated"
    },
    {
      "field": "funFacts",
      "source": "National Geographic / Smithsonian",
      "url": "https://www.smithsonianmag.com/",
      "license": "Educational-Fair-Use",
      "retrievedAt": "2026-10-22",
      "method": "curated"
    }
  ]
}