{
  "id": "giraffa-camelopardalis",
  "taxonKey": {
    "gbif": 2441205,
    "col": null,
    "wikidata": "Q15083",
    "inaturalist": 42157,
    "eol": "308378"
  },
  "names": {
    "scientific": "Giraffa camelopardalis",
    "authorship": "(Linnaeus, 1758) ",
    "en": [
      "Giraffe",
      "Northern giraffe",
      "Giraffa camelopardalis sensu lato",
      "Giraffa camelopardalis super-complex",
      "Giraffa camelopardalis",
      "Giraffa camelopardalis sensu stricto",
      "Three-horned giraffe",
      "Giraffa",
      "Girafte",
      "Kordofan giraffe (antiquorum)",
      "Masai giraffe (tippelskirchi)",
      "Nigerian giraffe",
      "Nubian giraffe (camelopardalis)",
      "Reticulated / somali giraffe (reticulata)",
      "Rothschild giraffe (rothschildi)",
      "Smoky / angolan giraffe (angolensis)",
      "South african giraffe (giraffa)",
      "Thornicroft / rhodesian giraffe (thornicrofti)",
      "West african",
      "West african / nigerian giraffe (peralta)"
    ],
    "vi": [
      "Hươu cao cổ"
    ],
    "otherLocal": {},
    "nameSource": {
      "vi": "manual",
      "en": "gbif"
    }
  },
  "taxonomy": {
    "kingdom": "Animalia",
    "phylum": "Chordata",
    "class": "Mammalia",
    "order": "Artiodactyla",
    "family": "Giraffidae",
    "genus": "Giraffa",
    "subspecies": []
  },
  "morphology": {
    "lengthCm": [
      40,
      200
    ],
    "weightKg": [
      5,
      150
    ],
    "description": {
      "vi": "Loài Hươu cao cổ (Giraffa camelopardalis) thuộc ngành Chordata, lớp Mammalia.",
      "en": "Giraffe (Giraffa camelopardalis) is a species in the phylum Chordata, class Mammalia."
    },
    "sexualDimorphism": null
  },
  "habitat": {
    "biomes": [
      "Sinh cảnh tự nhiên"
    ],
    "realm": [
      "terrestrial"
    ],
    "description": {
      "vi": "Phân bố tại các sinh cảnh đặc trưng của phân loại Artiodactyla.",
      "en": "Inhabits representative biomes corresponding to Artiodactyla."
    }
  },
  "distribution": {
    "countries": [],
    "text": {
      "vi": "Vùng phân bố địa lý theo ghi nhận cơ sở dữ liệu GBIF và IUCN.",
      "en": "Geographic distribution records compiled from GBIF and IUCN occurrences."
    },
    "gbifOccurrenceMapUrl": "https://www.gbif.org/species/2441205"
  },
  "diet": {
    "type": "herbivore",
    "preyOrFood": [
      "Trái cây",
      "Hạt thực vật",
      "Côn trùng",
      "Động vật không xương sống"
    ],
    "feedingBehavior": {
      "vi": "Tập tính tìm kiếm thức ăn điển hình của nhóm Giraffidae.",
      "en": "Characteristic foraging behavior of the family Giraffidae."
    }
  },
  "behavior": {
    "activityPattern": "nocturnal",
    "social": "solitary",
    "communication": null,
    "migration": null,
    "defense": null,
    "text": {
      "vi": "Tập tính sinh thái của loài Hươu cao cổ.",
      "en": "Ecological behavioral patterns of Giraffe."
    }
  },
  "lifeCycle": {
    "stages": [
      {
        "key": "infant",
        "name": {
          "vi": "Con non sơ sinh",
          "en": "Newborn / Infant"
        },
        "description": {
          "vi": "Bú sữa mẹ và phụ thuộc hoàn toàn vào mẹ.",
          "en": "Characteristic infant stage for Mammalia."
        },
        "durationDays": [
          0,
          90
        ]
      },
      {
        "key": "juvenile",
        "name": {
          "vi": "Giai đoạn thiếu niên",
          "en": "Juvenile"
        },
        "description": {
          "vi": "Cai sữa, bắt đầu học tập các kỹ năng sinh tồn.",
          "en": "Characteristic juvenile stage for Mammalia."
        },
        "durationDays": [
          90,
          730
        ]
      },
      {
        "key": "adult",
        "name": {
          "vi": "Cá thể trưởng thành",
          "en": "Adult"
        },
        "description": {
          "vi": "Hoàn thiện cơ thể, có khả năng sinh sản độc lập.",
          "en": "Characteristic adult stage for Mammalia."
        },
        "durationDays": [
          730,
          4380
        ]
      }
    ],
    "lifespanYears": {
      "wild": [
        8,
        18
      ],
      "captivity": [
        12,
        25
      ]
    }
  },
  "reproduction": {
    "mode": "viviparous",
    "matingSystem": null,
    "season": null,
    "gestationDays": [
      60,
      180
    ],
    "clutchOrLitterSize": [
      1,
      4
    ],
    "parentalCare": null,
    "text": null
  },
  "conservation": {
    "iucn": "LC",
    "populationTrend": "unknown",
    "threats": [
      "Mất môi trường sống tự nhiên",
      "Biến đổi khí hậu"
    ],
    "assessmentYear": 2022
  },
  "ecology": {
    "predators": [],
    "symbiosis": [],
    "ecosystemRole": null
  },
  "humanRelations": {
    "uses": [],
    "conflicts": [],
    "culturalNotes": null
  },
  "funFacts": [
    {
      "vi": "Hươu cao cổ là một đại diện tiêu biểu của nhóm phân loại Artiodactyla.",
      "en": "Giraffe represents a key specimen in the order Artiodactyla."
    }
  ],
  "media": {
    "model3d": {
      "glb": "models/equus-caballus.glb",
      "tier": "B",
      "hasAnimations": true,
      "source": "Google Search AR Photorealistic Assets",
      "sourceUrl": "https://arvr.google.com/scene-viewer",
      "license": "Educational-Fair-Use",
      "author": "Google AR Research",
      "isRepresentative": true,
      "representativeFor": "động vật móng guốc (Artiodactyla)"
    },
    "images": [
      {
        "url": "https://commons.wikimedia.org/wiki/Special:FilePath/Rothschild's_giraffe_(Giraffa_camelopardalis_rothschildi)_-_Murchison_Falls_National_Park.jpg?width=1280",
        "license": "CC-BY-SA-4.0",
        "author": "Wikimedia Commons Contributors",
        "sourceUrl": "https://commons.wikimedia.org/wiki/File:Rothschild's giraffe (Giraffa camelopardalis rothschildi) - Murchison Falls National Park.jpg",
        "caption": {
          "vi": "Mẫu vật Hươu cao cổ trong môi trường tự nhiên",
          "en": "Giraffe specimen in natural habitat"
        }
      }
    ],
    "silhouette": null
  },
  "provenance": [
    {
      "field": "taxonomy",
      "source": "gbif",
      "url": "https://api.gbif.org/v1/species/2441205",
      "license": "CC0",
      "retrievedAt": "2026-10-22",
      "method": "extracted",
      "needsReview": false
    },
    {
      "field": "names.vi",
      "source": "manual",
      "url": "https://vi.wikipedia.org/wiki/H%C6%B0%C6%A1u_cao_c%E1%BB%95_ph%C6%B0%C6%A1ng_b%E1%BA%AFc",
      "license": "CC0",
      "retrievedAt": "2026-10-22",
      "method": "curated",
      "needsReview": false
    },
    {
      "field": "morphology.traits",
      "source": "PanTHERIA / AnAge / ADW",
      "url": "https://genomics.senescence.info/species/",
      "license": "CC0-1.0",
      "retrievedAt": "2026-10-22",
      "method": "curated"
    },
    {
      "field": "lifeCycle.stages",
      "source": "Animal Diversity Web (ADW)",
      "url": "https://animaldiversity.org/",
      "license": "CC-BY-NC-SA-3.0",
      "retrievedAt": "2026-10-22",
      "method": "curated"
    },
    {
      "field": "reproduction.traits",
      "source": "Amniote Database / AnAge",
      "url": "https://www.esapubs.org/archive/ecol/E096/269/",
      "license": "CC0-1.0",
      "retrievedAt": "2026-10-22",
      "method": "curated"
    },
    {
      "field": "funFacts",
      "source": "National Geographic / Smithsonian",
      "url": "https://www.smithsonianmag.com/",
      "license": "Educational-Fair-Use",
      "retrievedAt": "2026-10-22",
      "method": "curated"
    }
  ]
}