{
  "id": "panthera-pardus",
  "taxonKey": {
    "gbif": 5219436,
    "col": null,
    "wikidata": "Q34706",
    "inaturalist": 41963,
    "eol": "328673"
  },
  "names": {
    "scientific": "Panthera pardus",
    "authorship": "(Linnaeus, 1758) ",
    "en": [
      "Leopard",
      "Panther",
      "Panthera pardus",
      "Black leopard",
      "Common leopard",
      "Leopoard"
    ],
    "vi": [
      "Báo hoa mai",
      "Panthera pardus"
    ],
    "otherLocal": {},
    "nameSource": {
      "vi": "manual",
      "en": "gbif"
    }
  },
  "taxonomy": {
    "kingdom": "Animalia",
    "phylum": "Chordata",
    "class": "Mammalia",
    "order": "Carnivora",
    "family": "Felidae",
    "genus": "Panthera",
    "subspecies": []
  },
  "morphology": {
    "lengthCm": null,
    "weightKg": null,
    "description": {
      "vi": "Loài Báo hoa mai (Panthera pardus) thuộc ngành Chordata, lớp Mammalia.",
      "en": "Leopard (Panthera pardus) is a species in the phylum Chordata, class Mammalia."
    },
    "sexualDimorphism": null
  },
  "habitat": {
    "biomes": [
      "Sinh cảnh tự nhiên"
    ],
    "realm": [
      "terrestrial"
    ],
    "description": {
      "vi": "Phân bố tại các sinh cảnh đặc trưng của phân loại Carnivora.",
      "en": "Inhabits representative biomes corresponding to Carnivora."
    }
  },
  "distribution": {
    "countries": [],
    "text": {
      "vi": "Vùng phân bố địa lý theo ghi nhận cơ sở dữ liệu GBIF và IUCN.",
      "en": "Geographic distribution records compiled from GBIF and IUCN occurrences."
    },
    "gbifOccurrenceMapUrl": "https://www.gbif.org/species/5219436"
  },
  "diet": {
    "type": "carnivore",
    "preyOrFood": [],
    "feedingBehavior": {
      "vi": "Tập tính tìm kiếm thức ăn điển hình của nhóm Felidae.",
      "en": "Characteristic foraging behavior of the family Felidae."
    }
  },
  "behavior": {
    "activityPattern": "nocturnal",
    "social": "solitary",
    "communication": null,
    "migration": null,
    "defense": null,
    "text": {
      "vi": "Tập tính sinh thái của loài Báo hoa mai.",
      "en": "Ecological behavioral patterns of Leopard."
    }
  },
  "lifeCycle": {
    "stages": [],
    "lifespanYears": null
  },
  "reproduction": {
    "mode": "viviparous",
    "matingSystem": null,
    "season": null,
    "gestationDays": null,
    "clutchOrLitterSize": null,
    "parentalCare": null,
    "text": null
  },
  "conservation": {
    "iucn": "LC",
    "populationTrend": "unknown",
    "threats": [
      "Mất môi trường sống tự nhiên",
      "Biến đổi khí hậu"
    ],
    "assessmentYear": 2022
  },
  "ecology": {
    "predators": [],
    "symbiosis": [],
    "ecosystemRole": null
  },
  "humanRelations": {
    "uses": [],
    "conflicts": [],
    "culturalNotes": null
  },
  "funFacts": [
    {
      "vi": "Báo hoa mai là một đại diện tiêu biểu của nhóm phân loại Carnivora.",
      "en": "Leopard represents a key specimen in the order Carnivora."
    }
  ],
  "media": {
    "model3d": {
      "glb": "models/vulpes-vulpes.glb",
      "tier": "B",
      "license": "CC0 / CC-BY-4.0",
      "author": "PixelMannen",
      "sourceUrl": "https://github.com/KhronosGroup/glTF-Sample-Assets",
      "isRepresentative": true,
      "representativeFor": "Mammalia"
    },
    "images": [
      {
        "url": "https://commons.wikimedia.org/wiki/Special:FilePath/Male_leopard_-_Mara.jpg?width=1280",
        "license": "CC-BY-SA-4.0",
        "author": "Wikimedia Commons Contributors",
        "sourceUrl": "https://commons.wikimedia.org/wiki/File:Male leopard - Mara.jpg",
        "caption": {
          "vi": "Mẫu vật Báo hoa mai trong môi trường tự nhiên",
          "en": "Leopard specimen in natural habitat"
        }
      }
    ],
    "silhouette": null
  },
  "provenance": [
    {
      "field": "taxonomy",
      "source": "gbif",
      "url": "https://api.gbif.org/v1/species/5219436",
      "license": "CC0",
      "retrievedAt": "2026-10-22",
      "method": "extracted",
      "needsReview": false
    },
    {
      "field": "names.vi",
      "source": "manual",
      "url": "https://vi.wikipedia.org/wiki/B%C3%A1o_hoa_mai",
      "license": "CC0",
      "retrievedAt": "2026-10-22",
      "method": "curated",
      "needsReview": false
    }
  ]
}