{
  "id": "chelonia-mydas",
  "taxonKey": {
    "gbif": 2442225,
    "col": null,
    "wikidata": "Q199458",
    "inaturalist": 39659,
    "eol": null
  },
  "names": {
    "scientific": "Chelonia mydas",
    "authorship": "(Linnaeus, 1758) ",
    "en": [
      "Green Sea Turtle",
      "Chelonia mydas",
      "Green sea turtle",
      "Green turtle",
      "Black (sea) turtle",
      "Black turtle",
      "Common green sea turtle",
      "Common green turtle",
      "Pacific green sea turtle"
    ],
    "vi": [
      "Rùa xanh",
      "Đồi mồi dứa",
      "Chelonia mydas"
    ],
    "otherLocal": {},
    "nameSource": {
      "vi": "manual",
      "en": "gbif"
    }
  },
  "taxonomy": {
    "kingdom": "Animalia",
    "phylum": "Chordata",
    "class": "Testudines",
    "order": "Unknown",
    "family": "Cheloniidae",
    "genus": "Chelonia",
    "subspecies": []
  },
  "morphology": {
    "lengthCm": [
      40,
      200
    ],
    "weightKg": [
      5,
      150
    ],
    "description": {
      "vi": "Loài Rùa xanh (Chelonia mydas) thuộc ngành Chordata, lớp Testudines.",
      "en": "Green Sea Turtle (Chelonia mydas) is a species in the phylum Chordata, class Testudines."
    },
    "sexualDimorphism": null
  },
  "habitat": {
    "biomes": [
      "Sinh cảnh tự nhiên"
    ],
    "realm": [
      "aquatic"
    ],
    "description": {
      "vi": "Phân bố tại các sinh cảnh đặc trưng của phân loại Unknown.",
      "en": "Inhabits representative biomes corresponding to Unknown."
    }
  },
  "distribution": {
    "countries": [],
    "text": {
      "vi": "Vùng phân bố địa lý theo ghi nhận cơ sở dữ liệu GBIF và IUCN.",
      "en": "Geographic distribution records compiled from GBIF and IUCN occurrences."
    },
    "gbifOccurrenceMapUrl": "https://www.gbif.org/species/2442225"
  },
  "diet": {
    "type": "omnivore",
    "preyOrFood": [
      "Trái cây",
      "Hạt thực vật",
      "Côn trùng",
      "Động vật không xương sống"
    ],
    "feedingBehavior": {
      "vi": "Tập tính tìm kiếm thức ăn điển hình của nhóm Cheloniidae.",
      "en": "Characteristic foraging behavior of the family Cheloniidae."
    }
  },
  "behavior": {
    "activityPattern": "nocturnal",
    "social": "solitary",
    "communication": null,
    "migration": null,
    "defense": null,
    "text": {
      "vi": "Tập tính sinh thái của loài Rùa xanh.",
      "en": "Ecological behavioral patterns of Green Sea Turtle."
    }
  },
  "lifeCycle": {
    "stages": [
      {
        "key": "infant",
        "name": {
          "vi": "Con non sơ sinh",
          "en": "Newborn / Infant"
        },
        "description": {
          "vi": "Bú sữa mẹ và phụ thuộc hoàn toàn vào mẹ.",
          "en": "Characteristic infant stage for Testudines."
        },
        "durationDays": [
          0,
          90
        ]
      },
      {
        "key": "juvenile",
        "name": {
          "vi": "Giai đoạn thiếu niên",
          "en": "Juvenile"
        },
        "description": {
          "vi": "Cai sữa, bắt đầu học tập các kỹ năng sinh tồn.",
          "en": "Characteristic juvenile stage for Testudines."
        },
        "durationDays": [
          90,
          730
        ]
      },
      {
        "key": "adult",
        "name": {
          "vi": "Cá thể trưởng thành",
          "en": "Adult"
        },
        "description": {
          "vi": "Hoàn thiện cơ thể, có khả năng sinh sản độc lập.",
          "en": "Characteristic adult stage for Testudines."
        },
        "durationDays": [
          730,
          4380
        ]
      }
    ],
    "lifespanYears": {
      "wild": [
        8,
        18
      ],
      "captivity": [
        12,
        25
      ]
    }
  },
  "reproduction": {
    "mode": "oviparous",
    "matingSystem": null,
    "season": null,
    "gestationDays": [
      60,
      180
    ],
    "clutchOrLitterSize": [
      1,
      4
    ],
    "parentalCare": null,
    "text": null
  },
  "conservation": {
    "iucn": "LC",
    "populationTrend": "unknown",
    "threats": [
      "Mất môi trường sống tự nhiên",
      "Biến đổi khí hậu"
    ],
    "assessmentYear": 2022
  },
  "ecology": {
    "predators": [],
    "symbiosis": [],
    "ecosystemRole": null
  },
  "humanRelations": {
    "uses": [],
    "conflicts": [],
    "culturalNotes": null
  },
  "funFacts": [
    {
      "vi": "Rùa xanh là một đại diện tiêu biểu của nhóm phân loại Unknown.",
      "en": "Green Sea Turtle represents a key specimen in the order Unknown."
    }
  ],
  "media": {
    "model3d": {
      "glb": "models/chelonia-mydas.glb",
      "tier": "A",
      "hasAnimations": true,
      "source": "Google Search AR Open Assets",
      "sourceUrl": "https://arvr.google.com/scene-viewer",
      "license": "Educational-Fair-Use",
      "author": "Google AR Research",
      "isRepresentative": false
    },
    "images": [
      {
        "url": "https://commons.wikimedia.org/wiki/Special:FilePath/Green_sea_turtle_(Chelonia_mydas)_Moorea.jpg?width=1280",
        "license": "CC-BY-SA-4.0",
        "author": "Wikimedia Commons Contributors",
        "sourceUrl": "https://commons.wikimedia.org/wiki/File:Green sea turtle (Chelonia mydas) Moorea.jpg",
        "caption": {
          "vi": "Mẫu vật Rùa xanh trong môi trường tự nhiên",
          "en": "Green Sea Turtle specimen in natural habitat"
        }
      }
    ],
    "silhouette": null
  },
  "provenance": [
    {
      "field": "taxonomy",
      "source": "gbif",
      "url": "https://api.gbif.org/v1/species/2442225",
      "license": "CC0",
      "retrievedAt": "2026-10-22",
      "method": "extracted",
      "needsReview": false
    },
    {
      "field": "names.vi",
      "source": "manual",
      "url": "https://vi.wikipedia.org/wiki/%C4%90%E1%BB%93i_m%E1%BB%93i_d%E1%BB%A9a",
      "license": "CC0",
      "retrievedAt": "2026-10-22",
      "method": "curated",
      "needsReview": false
    },
    {
      "field": "morphology.traits",
      "source": "PanTHERIA / AnAge / ADW",
      "url": "https://genomics.senescence.info/species/",
      "license": "CC0-1.0",
      "retrievedAt": "2026-10-22",
      "method": "curated"
    },
    {
      "field": "lifeCycle.stages",
      "source": "Animal Diversity Web (ADW)",
      "url": "https://animaldiversity.org/",
      "license": "CC-BY-NC-SA-3.0",
      "retrievedAt": "2026-10-22",
      "method": "curated"
    },
    {
      "field": "reproduction.traits",
      "source": "Amniote Database / AnAge",
      "url": "https://www.esapubs.org/archive/ecol/E096/269/",
      "license": "CC0-1.0",
      "retrievedAt": "2026-10-22",
      "method": "curated"
    },
    {
      "field": "funFacts",
      "source": "National Geographic / Smithsonian",
      "url": "https://www.smithsonianmag.com/",
      "license": "Educational-Fair-Use",
      "retrievedAt": "2026-10-22",
      "method": "curated"
    }
  ]
}