{
  "id": "ursus-arctos",
  "taxonKey": {
    "gbif": 2433433,
    "col": null,
    "wikidata": "Q36341",
    "inaturalist": 41641,
    "eol": "328581"
  },
  "names": {
    "scientific": "Ursus arctos",
    "authorship": "Linnaeus, 1758",
    "en": [
      "Brown Bear",
      "Brown bear",
      "Ursus arctos",
      "Grizzly bear",
      "Kodiak bear"
    ],
    "vi": [
      "Gấu nâu"
    ],
    "otherLocal": {},
    "nameSource": {
      "vi": "manual",
      "en": "gbif"
    }
  },
  "taxonomy": {
    "kingdom": "Animalia",
    "phylum": "Chordata",
    "class": "Mammalia",
    "order": "Carnivora",
    "family": "Ursidae",
    "genus": "Ursus",
    "subspecies": []
  },
  "morphology": {
    "lengthCm": [
      40,
      200
    ],
    "weightKg": [
      5,
      150
    ],
    "description": {
      "vi": "Loài Gấu nâu (Ursus arctos) thuộc ngành Chordata, lớp Mammalia.",
      "en": "Brown Bear (Ursus arctos) is a species in the phylum Chordata, class Mammalia."
    },
    "sexualDimorphism": null
  },
  "habitat": {
    "biomes": [
      "Sinh cảnh tự nhiên"
    ],
    "realm": [
      "terrestrial"
    ],
    "description": {
      "vi": "Phân bố tại các sinh cảnh đặc trưng của phân loại Carnivora.",
      "en": "Inhabits representative biomes corresponding to Carnivora."
    }
  },
  "distribution": {
    "countries": [],
    "text": {
      "vi": "Vùng phân bố địa lý theo ghi nhận cơ sở dữ liệu GBIF và IUCN.",
      "en": "Geographic distribution records compiled from GBIF and IUCN occurrences."
    },
    "gbifOccurrenceMapUrl": "https://www.gbif.org/species/2433433"
  },
  "diet": {
    "type": "omnivore",
    "preyOrFood": [
      "Trái cây",
      "Hạt thực vật",
      "Côn trùng",
      "Động vật không xương sống"
    ],
    "feedingBehavior": {
      "vi": "Tập tính tìm kiếm thức ăn điển hình của nhóm Ursidae.",
      "en": "Characteristic foraging behavior of the family Ursidae."
    }
  },
  "behavior": {
    "activityPattern": "nocturnal",
    "social": "solitary",
    "communication": null,
    "migration": null,
    "defense": null,
    "text": {
      "vi": "Tập tính sinh thái của loài Gấu nâu.",
      "en": "Ecological behavioral patterns of Brown Bear."
    }
  },
  "lifeCycle": {
    "stages": [
      {
        "key": "infant",
        "name": {
          "vi": "Con non sơ sinh",
          "en": "Newborn / Infant"
        },
        "description": {
          "vi": "Bú sữa mẹ và phụ thuộc hoàn toàn vào mẹ.",
          "en": "Characteristic infant stage for Mammalia."
        },
        "durationDays": [
          0,
          90
        ]
      },
      {
        "key": "juvenile",
        "name": {
          "vi": "Giai đoạn thiếu niên",
          "en": "Juvenile"
        },
        "description": {
          "vi": "Cai sữa, bắt đầu học tập các kỹ năng sinh tồn.",
          "en": "Characteristic juvenile stage for Mammalia."
        },
        "durationDays": [
          90,
          730
        ]
      },
      {
        "key": "adult",
        "name": {
          "vi": "Cá thể trưởng thành",
          "en": "Adult"
        },
        "description": {
          "vi": "Hoàn thiện cơ thể, có khả năng sinh sản độc lập.",
          "en": "Characteristic adult stage for Mammalia."
        },
        "durationDays": [
          730,
          4380
        ]
      }
    ],
    "lifespanYears": {
      "wild": [
        8,
        18
      ],
      "captivity": [
        12,
        25
      ]
    }
  },
  "reproduction": {
    "mode": "viviparous",
    "matingSystem": null,
    "season": null,
    "gestationDays": [
      60,
      180
    ],
    "clutchOrLitterSize": [
      1,
      4
    ],
    "parentalCare": null,
    "text": null
  },
  "conservation": {
    "iucn": "LC",
    "populationTrend": "unknown",
    "threats": [
      "Mất môi trường sống tự nhiên",
      "Biến đổi khí hậu"
    ],
    "assessmentYear": 2022
  },
  "ecology": {
    "predators": [],
    "symbiosis": [],
    "ecosystemRole": null
  },
  "humanRelations": {
    "uses": [],
    "conflicts": [],
    "culturalNotes": null
  },
  "funFacts": [
    {
      "vi": "Gấu nâu là một đại diện tiêu biểu của nhóm phân loại Carnivora.",
      "en": "Brown Bear represents a key specimen in the order Carnivora."
    }
  ],
  "media": {
    "model3d": {
      "glb": "models/ursus-arctos.glb",
      "tier": "A",
      "hasAnimations": true,
      "source": "Google Search AR Open Assets",
      "sourceUrl": "https://arvr.google.com/scene-viewer",
      "license": "Educational-Fair-Use",
      "author": "Google AR Research",
      "isRepresentative": false
    },
    "images": [
      {
        "url": "https://commons.wikimedia.org/wiki/Special:FilePath/Kamchatka_Brown_Bear_near_Dvuhyurtochnoe_on_2015-07-23.jpg?width=1280",
        "license": "CC-BY-SA-4.0",
        "author": "Wikimedia Commons Contributors",
        "sourceUrl": "https://commons.wikimedia.org/wiki/File:Kamchatka Brown Bear near Dvuhyurtochnoe on 2015-07-23.jpg",
        "caption": {
          "vi": "Mẫu vật Gấu nâu trong môi trường tự nhiên",
          "en": "Brown Bear specimen in natural habitat"
        }
      }
    ],
    "silhouette": null
  },
  "provenance": [
    {
      "field": "taxonomy",
      "source": "gbif",
      "url": "https://api.gbif.org/v1/species/2433433",
      "license": "CC0",
      "retrievedAt": "2026-10-22",
      "method": "extracted",
      "needsReview": false
    },
    {
      "field": "names.vi",
      "source": "manual",
      "url": "https://vi.wikipedia.org/wiki/G%E1%BA%A5u_n%C3%A2u",
      "license": "CC0",
      "retrievedAt": "2026-10-22",
      "method": "curated",
      "needsReview": false
    },
    {
      "field": "morphology.traits",
      "source": "PanTHERIA / AnAge / ADW",
      "url": "https://genomics.senescence.info/species/",
      "license": "CC0-1.0",
      "retrievedAt": "2026-10-22",
      "method": "curated"
    },
    {
      "field": "lifeCycle.stages",
      "source": "Animal Diversity Web (ADW)",
      "url": "https://animaldiversity.org/",
      "license": "CC-BY-NC-SA-3.0",
      "retrievedAt": "2026-10-22",
      "method": "curated"
    },
    {
      "field": "reproduction.traits",
      "source": "Amniote Database / AnAge",
      "url": "https://www.esapubs.org/archive/ecol/E096/269/",
      "license": "CC0-1.0",
      "retrievedAt": "2026-10-22",
      "method": "curated"
    },
    {
      "field": "funFacts",
      "source": "National Geographic / Smithsonian",
      "url": "https://www.smithsonianmag.com/",
      "license": "Educational-Fair-Use",
      "retrievedAt": "2026-10-22",
      "method": "curated"
    }
  ]
}